<?xml version="1.0"?>
<taskflows xmlns="http://www.charse.com.cn"
           xmlns:xsi="http://www.w3.org/2001/XMLSchema-instance"
           xsi:schemaLocation="http://www.charse.com.cn taskflows.xsd">
    <taskflow id="productReserve" start-task="first-task" use-spring="false" validate="true">
        <filters>
            <filter class-name="com.charse.test.local.FirstFilter"/>
        </filters>
        <task task-id="first-task">
            <invoke class-name="com.charse.test.local.FirstTask"/>
            <results>
                <result road="Jump2" next-stop="second-task"/>
                <result road="#P" next-stop="third-task"/>
            </results>
        </task>
        <task task-id="second-task">
            <invoke class-name="com.charse.test.local.SecondTask"/>
            <results>
                <result road="Jump3" next-stop="third-task"/>
            </results>
        </task>
        <task task-id="third-task">
            <invoke class-name="com.charse.test.local.ThirdTask"/>
        </task>
    </taskflow>
</taskflows>